Question,Answer,Context,Intent,Entities,Difficulty,Volatility Level,Comments
"What are the main Capstone tracks available to students?","The main Capstone tracks are: Software Engineering Track, Network Engineering Track, Capstone Enterprise Track, and the Capstone Teaching/Coaching Track.","Capstone Tracks Overview","Identify all main tracks","Software Engineering, Network Engineering, Enterprise, Teaching/Coaching","Easy","Low","Basic listing of tracks"
"How many primary tracks are offered in the YWCC Capstone program?","There are four primary tracks offered.","Capstone Tracks Overview","Count number of tracks","Four primary tracks","Easy","Low","Straightforward numerical detail"
"What does the Software Engineering Track focus on?","The Software Engineering Track focuses on building software solutions, either through Industry-Sponsored Projects or Student Startup Projects.","Software Engineering Track","Explain focus","Software solutions, Industry-sponsored, Startup projects","Easy","Low","Fundamental definition"
"What are the two options under the Software Engineering Track?","Under the Software Engineering Track, students can choose Industry-Sponsored Projects or Student Startup Projects.","Software Engineering Track","Identify sub-options","Industry-Sponsored Projects, Student Startup Projects","Easy","Low","Directly from the description"
"What is an Industry-Sponsored Project in the Software Engineering Track?","Industry-Sponsored Projects involve working with external companies or organizations to solve real-world challenges through software solutions.","Software Engineering Track","Define sub-option","Industry-Sponsored Project","Medium","Low","Partnership with companies"
"What is a Student Startup Project in the Software Engineering Track?","A Student Startup Project is a student-led entrepreneurial initiative where a team develops a proof-of-concept for an innovative solution with market potential.","Software Engineering Track","Define sub-option","Student Startup Project","Medium","Low","Entrepreneurial focus"
"Why might a student choose a Student Startup Project over an Industry-Sponsored Project?","A student might choose a Startup Project to innovate independently, build a product from scratch, experience entrepreneurial challenges, and potentially create a new business concept.","Software Engineering Track","Explain reasons","Innovation, Entrepreneurship, Independence","Medium","Low","Motivation detail"
"What criteria must a Student Startup proposal meet?","It must be unique, have a competitive advantage, be feasible within one semester, have sufficient background knowledge from the founder, and offer a valuable learning experience for YWCC students.","Software Engineering Track","List criteria","Competitive advantage, Feasibility, Learning experience","Medium","Low","Startup requirements"
"What is the focus of the Network Engineering Track?","The Network Engineering Track focuses on network design, configuration, troubleshooting, and learning through the CISCO Academy and associated Cisco project activities.","Network Engineering Track","Explain track focus","Network design, Cisco Academy, Cisco project","Medium","Low","Technical networking skills"
"Which program forms part of the Network Engineering Track?","The CISCO Academy + CISCO Project forms a key part of the Network Engineering Track.","Network Engineering Track","Identify program","CISCO Academy, CISCO Project","Easy","Low","Direct association"
"What can students expect to learn in the Network Engineering Track?","They learn about routing, switching, network security, and other foundational networking concepts to prepare them for Cisco-related certifications and real-world network engineering tasks.","Network Engineering Track","Describe learning outcomes","Routing, Switching, Network Security, Cisco certifications","Medium","Low","Curriculum highlight"
"How does the CISCO Academy help students?","The CISCO Academy provides structured training, official course materials, and hands-on practice with networking tools and technologies, helping students gain industry-relevant skills and certifications.","Network Engineering Track","Explain benefit","CISCO Academy training, Industry relevance","Medium","Low","Value of Cisco program"
"What is the Capstone Enterprise Track?","The Capstone Enterprise Track involves working on internal teams that support the overall Capstone program operations, media, communications, and automation needs.","Enterprise Track","Define track","Operations team, Media & Communications team, Automation team","Medium","Low","Internal support focus"
"What are some examples of teams within the Enterprise Track?","Examples include the Operations Team, the Media & Communications Team, and the Automation Team.","Enterprise Track","List sub-teams","Operations, Media & Communications, Automation","Easy","Low","Subdivision of the Enterprise Track"
"What does the Operations Team do in the Enterprise Track?","The Operations Team supports course logistics, helps with announcements, coordinates events, and ensures smooth operations throughout the semester.","Enterprise Track","Define team role","Operations Team","Medium","Low","Administrative role"
"What is the responsibility of the Media & Communications Team?","The Media & Communications Team handles marketing, branding, promotional materials, social media, and announcements to enhance the visibility of the Capstone program.","Enterprise Track","Define team role","Media & Communications Team","Medium","Low","Marketing and outreach"
"What does the Automation Team focus on?","The Automation Team focuses on creating and improving tools, scripts, and processes to streamline administrative and project-related tasks within the Capstone ecosystem.","Enterprise Track","Define team role","Automation Team","Medium","Low","Efficiency and process improvement"
"Why might a student choose the Enterprise Track over Software Engineering or Network Engineering?","A student may prefer Enterprise if they want to develop organizational, communication, management, and media skills rather than focusing solely on software or networking.","Enterprise Track","Explain choice","Organizational skills, Communication, Management","Medium","Low","Broader skill set"
"What is the Capstone Teaching/Coaching Track about?","The Teaching/Coaching Track involves guiding and mentoring others, such as providing technical coaching in software or network engineering, or working with the RWC program to teach younger students.","Teaching/Coaching Track","Define track","Coaching, Mentoring, Teaching, RWC","Medium","Low","Educational support role"
"What sub-options are available under the Teaching/Coaching Track?","Sub-options include Software Engineering Coaching, Network Engineering Coaching, RWC Coaching for middle/high school students, and RWC International Traveling Coaches opportunities.","Teaching/Coaching Track","List sub-options","Software Coaching, Network Coaching, RWC Coaching","Medium","Low","Multiple mentoring paths"
"What is Software Engineering Coaching in the Teaching/Coaching Track?","Software Engineering Coaching involves mentoring other students or participants, guiding them through coding practices, software design, debugging, and best practices in software development.","Teaching/Coaching Track","Define sub-option","Software Engineering Coaching","Medium","Low","Focus on teaching coding skills"
"What does Network Engineering Coaching entail?","Network Engineering Coaching means helping learners understand networking concepts, troubleshoot network issues, and apply Cisco methodologies, effectively teaching what was learned in the Network Engineering Track.","Teaching/Coaching Track","Define sub-option","Network Engineering Coaching","Medium","Low","Peer instruction on networking"
"What is RWC Coaching?","RWC Coaching involves working with Saturday programs for middle/high school students, teaching them STEM concepts, coding, problem-solving, and inspiring them to pursue tech-related paths.","Teaching/Coaching Track","Define sub-option","RWC Coaching","Medium","Low","Youth education focus"
"How do RWC International Traveling Coaches differ from local RWC Coaches?","RWC International Traveling Coaches travel abroad (e.g., to South America) to conduct workshops, mentoring sessions, and educational programs, thus extending the RWC mission globally.","Teaching/Coaching Track","Distinguish roles","RWC International Traveling Coaches","Hard","Medium","Global outreach"
"Which track would be best for a student interested in improving their public speaking and leadership skills?","The Teaching/Coaching Track and Enterprise Track are both good choices, as they involve communication, presentation, and team leadership roles.","Track Selection","Recommend track","Teaching/Coaching, Enterprise","Medium","Low","Skill-based recommendation"
"If a student wants to focus on building a marketable software product from scratch, which track should they choose?","They should choose the Software Engineering Track and opt for a Student Startup Project option.","Track Selection","Recommend track","Software Engineering, Startup Project","Medium","Low","Entrepreneurial path"
"Which track is most aligned with preparing for industry certifications like CCNA?","The Network Engineering Track aligns well with Cisco Academy coursework that can help prepare for CCNA or related certifications.","Track Selection","Recommend track","Network Engineering, Cisco Academy","Medium","Low","Certification preparation"
"Do all tracks follow the MDDDE methodology?","Yes, all tracks utilize the MDDDE (Manage, Define, Design, Develop, Evaluate) approach, although the specifics of each phase may differ depending on the track’s nature.","Capstone Methodology","Confirm methodology use","MDDDE in all tracks","Medium","Low","Universal project framework"
"Are there any prerequisites to joining a particular track?","Each track may have different recommended skills: Software Engineering often requires coding ability, Network Engineering may require some networking knowledge, Enterprise involves organizational and communication skills, and Teaching/Coaching prefers strong communication and mentoring ability.","Track Requirements","Explain prerequisites","Skills requirements per track","Medium","Medium","Skill alignment"
"Can a student switch tracks mid-semester?","Switching tracks mid-semester is generally discouraged and would require special approval from the instructor and possibly the sponsor.","Track Selection","Clarify policy","Track switching","Hard","High","Stability and commitment"
"How are teams formed within each track?","Teams are formed based on interest, application approvals, sponsor or instructor decisions, and the Open House event where students and sponsors meet.","Team Formation","Explain process","Team formation per track","Medium","Medium","Common process"
"Do all tracks have sponsors?","The Software Engineering Track (Industry projects) and some Network Engineering projects may have sponsors, while Enterprise teams and some Teaching/Coaching roles may be coordinated internally by the course staff.","Tracks and Sponsors","Differentiate","Sponsors vary by track","Medium","Medium","Contextual differences"
"What if a student wants to combine teaching with software development?","They could choose the Teaching/Coaching Track focusing on Software Engineering Coaching, thus blending technical and mentoring roles.","Customized Path","Suggest combination","Software Engineering Coaching","Medium","Low","Hybrid role"
"Which track might involve creating marketing materials or managing social media?","The Enterprise Track’s Media & Communications Team would involve creating marketing content, managing social media, and promoting the program.","Enterprise Track","Match interest","Media & Communications","Easy","Low","Creative skills"
"Is the RWC Coaching considered a separate track or part of Teaching/Coaching?","RWC Coaching is a sub-option under the Teaching/Coaching Track, focusing on community outreach and youth education.","Teaching/Coaching Track","Clarify classification","RWC under Teaching/Coaching","Easy","Low","Part of a larger category"
"What if a student wants a leadership role without deep technical involvement?","The Enterprise Track may be suitable, as it offers roles that emphasize organization, communication, and project management over technical depth.","Track Selection","Recommend track","Enterprise roles","Medium","Low","Non-technical leadership"
"Can multiple students propose startup projects under the Software Engineering Track?","Yes, multiple students can propose different startup ideas, but each must meet the criteria and be approved as a Capstone project.","Startup Projects","Clarify possibility","Multiple startups","Medium","Medium","Capacity for innovation"
"Do Teaching/Coaching Track students also produce deliverables like Scope or Time Management documents?","Yes, all Capstone teams regardless of track must produce required deliverables, although the nature of their outputs may be different (e.g., lesson plans instead of product prototypes).","Deliverables","Explain consistency","Scope/Time docs in all tracks","Medium","Low","Universal requirements"
"Is the Network Engineering Track limited to Cisco technologies only?","While heavily focused on Cisco due to the Academy, the general networking principles learned apply broadly, but the track emphasizes Cisco tools and certifications.","Network Engineering Track","Clarify scope","Cisco focus","Medium","Medium","Brand-specific but generally applicable"
"Which track would best suit someone interested in international educational travel?","The Teaching/Coaching Track with the RWC International Traveling Coaches option would be the best fit for international educational experiences.","Track Selection","Match interest","RWC International","Medium","Medium","Unique experience"
"How do sponsors interact with different tracks?","Industry sponsors primarily work with Software Engineering (Industry) or certain Network Engineering projects, while Enterprise and Teaching/Coaching teams often interact more with instructors and internal course staff.","Sponsor Interaction","Explain differences","Track-sponsor interaction","Hard","Medium","Varies by track"
"If a student wants to practice Agile methods, which track supports that?","All tracks encourage Agile methods (like SCRUM) as part of MDDDE, so any track can practice Agile, especially Software Engineering projects.","Project Methodology","Confirm applicability","Agile in all tracks","Medium","Low","Universal methodology"
"Which track might involve creating internal process improvements for the Capstone program itself?","The Enterprise Track, particularly the Automation Team, focuses on internal process improvements and tools.","Enterprise Track","Identify innovation","Automation Team","Medium","Low","Internal efficiency"
"Are students in the Teaching/Coaching Track graded differently than those in other tracks?","All tracks follow similar grading structures (deliverables, presentations, sponsor or supervisor evaluations), but the nature of their work is different. The evaluation criteria remain consistent, though tailored to their role.","Grading","Clarify grading","Similar grading standards","Medium","Low","Comparable evaluation"
"Can a student in the Network Engineering Track also learn some software development skills?","They might learn basic scripting or automation as part of network management, but the focus remains on networking rather than full-stack development.","Network Engineering Track","Clarify skill scope","Networking vs software dev","Medium","Low","Track focus"
"What if a student wants to gain media production skills?","Joining the Enterprise Track’s Media & Communications Team can help them learn video editing, graphic design, social media management, and branding strategies.","Enterprise Track","Suggest skill development","Media production","Medium","Low","Creative skill set"
"Is the Teaching/Coaching Track only for experienced tutors?","Not necessarily. While experience helps, training and guidelines are provided. The track is suitable for those who want to develop teaching and mentoring skills.","Teaching/Coaching Track","Clarify prerequisite","Not only experienced tutors","Medium","Low","Encouraging participation"
"Can a startup project in the Software Engineering Track become a real business?","Potentially, yes. If the proof-of-concept is strong, the student founder can continue development beyond the course and attempt to launch it as a real startup.","Startup Projects","Highlight potential outcome","Real business possibility","Medium","Medium","Future opportunities"
"What is the main difference between Enterprise Track and Software Engineering Track?","The Software Engineering Track focuses on building software products for sponsors or startups, while the Enterprise Track focuses on supporting the Capstone ecosystem itself through operations, communications, and automation.","Track Comparison","Distinguish roles","Software vs Enterprise focus","Medium","Low","Key differentiation"
"Does the Network Engineering Track include hands-on lab work?","Yes, students typically engage in hands-on lab exercises, simulations, and possibly real equipment configuration via the Cisco Academy resources.","Network Engineering Track","Confirm practice","Hands-on labs","Medium","Low","Practical experience"
"How does participating in the Teaching/Coaching Track help a student’s professional profile?","It improves communication, leadership, mentoring skills, and demonstrates the ability to convey technical concepts—qualities valuable for leadership and education roles.","Teaching/Coaching Track","Explain career impact","Leadership, Communication, Mentoring","Medium","Low","Soft skill development"
"Is there a limit to how many students can join a particular track?","While there may be capacity limits, generally students are placed according to their interests, test results, and sponsor needs. High-demand tracks may have more competition.","Enrollment","Clarify limits","Capacity constraints","Medium","High","Availability dependent"
"Can a student learn project management skills in any track?","Yes, project management skills are learned in all tracks as they follow MDDDE and require planning, scheduling, risk management, and communication.","Project Management","Confirm universality","Project management in all tracks","Easy","Low","Common skill"
"Which track might best suit a student who wants to improve their technical writing skills?","Any track can improve technical writing, but Teaching/Coaching and Enterprise roles (Operations team for documentation, Media & Communications for content) might place more emphasis on communication deliverables.","Track Selection","Suggest skill improvement","Technical writing in Enterprise/Teaching","Medium","Low","Flexibility in skill building"
